{
    "last_updated": "2023-07-17T13:34:13+02:00",
    "ttl": 0,
    "version": "3.0",
    "data": {
        "feeds": [
            {
                "name": "system_information",
                "url": "https://www.example.com/gbfs/1/system_information"
            },
            {
                "name": "station_information",
                "url": "https://www.example.com/gbfs/1/station_information"
            }
        ]
    }
}